{
  "v": 1,
  "type": "preview.state",
  "id": "00000000000000000000000000000002",
  "payload": {
    "process_id": 1234,
    "input_allowed": true,
    "ui_session_id": "8a54d6b0b6d94e1b9c8f6c1f3c2d1e0f",
    "ui_owner": {
      "actor_id": "be10cd89a4e841e7b708ae9cdbefeb77",
      "name": "VR user",
      "role": "vr"
    },
    "ui_ending": false,
    "modal_operators": [],
    "modal_active": false,
    "session_id": "2f05d1eb3f1e4ce98dd998abf20cdd33",
    "host_epoch": "de36341c159e4d63a802adfefdfd4683",
    "document_id": "15e12b8b8c12437098bb8a090659c8cb",
    "open_epoch": "5ac7931d230d4870a872dc9e363ca56d",
    "available": true,
    "reason": "",
    "tool": "line",
    "native_tool": "sketcher.slvs_add_line2d",
    "sketch_id": "420d772974c747ebb91283b7ff8d22a3",
    "mode": "OBJECT",
    "selected_entities": [],
    "unsupported_options": [],
    "unsupported_sketches": []
  },
  "re": "10000000000000000000000000000000"
}
