{
  "v": 1,
  "type": "scene.snapshot",
  "id": "dd0f8c618f51444fa7142d4524f44efe",
  "payload": {
    "document": {
      "id": "15e12b8b8c12437098bb8a090659c8cb",
      "open_epoch": "5ac7931d230d4870a872dc9e363ca56d",
      "name": "bracket.blend",
      "revision": 41,
      "dirty": false,
      "units": { "system": "METRIC", "length_unit": "MILLIMETERS", "rotation_unit": "DEGREES", "scale_length": 0.001 }
    },
    "objects": [
      {
        "id": "f21f7d20394f4c02afce7ab1e6f4a1a8",
        "name": "Base plate",
        "type": "MESH",
        "parent": null,
        "generation": 12,
        "visible": true,
        "transform": { "location": [0, 0, 0.005], "rotation": [1, 0, 0, 0], "scale": [1, 1, 1] },
        "color": [0.8, 0.8, 0.8, 1],
        "mesh": {
          "positions": [-0.05, -0.03, 0.005, 0.05, -0.03, 0.005, 0.05, 0.03, 0.005, -0.05, 0.03, 0.005, -0.05, 0.03, -0.005, 0.05, 0.03, -0.005, 0.05, -0.03, -0.005, -0.05, -0.03, -0.005, 0.05, -0.03, -0.005, 0.05, 0.03, -0.005, 0.05, 0.03, 0.005, 0.05, -0.03, 0.005, -0.05, 0.03, -0.005, -0.05, -0.03, -0.005, -0.05, -0.03, 0.005, -0.05, 0.03, 0.005, 0.05, 0.03, -0.005, -0.05, 0.03, -0.005, -0.05, 0.03, 0.005, 0.05, 0.03, 0.005, -0.05, -0.03, -0.005, 0.05, -0.03, -0.005, 0.05, -0.03, 0.005, -0.05, -0.03, 0.005],
          "normals": [0, 0, 1, 0, 0, 1, 0, 0, 1, 0, 0, 1, 0, 0, -1, 0, 0, -1, 0, 0, -1, 0, 0, -1, 1, 0, 0, 1, 0, 0, 1, 0, 0, 1, 0, 0, -1, 0, 0, -1, 0, 0, -1, 0, 0, -1, 0, 0, 0, 1, 0, 0, 1, 0, 0, 1, 0, 0, 1, 0, 0, -1, 0, 0, -1, 0, 0, -1, 0, 0, -1, 0],
          "indices": [0, 1, 2, 0, 2, 3, 4, 5, 6, 4, 6, 7, 8, 9, 10, 8, 10, 11, 12, 13, 14, 12, 14, 15, 16, 17, 18, 16, 18, 19, 20, 21, 22, 20, 22, 23]
        }
      },
      {
        "id": "fd7bd4ddae444528a4fedbc562fe018b",
        "name": "Shaft",
        "type": "MESH",
        "parent": "f21f7d20394f4c02afce7ab1e6f4a1a8",
        "generation": 40,
        "visible": true,
        "transform": { "location": [0.02, 0, 0.03], "rotation": [1, 0, 0, 0], "scale": [1, 1, 1] },
        "color": [0.25, 0.4, 0.8, 1],
        "mesh": {
          "positions": [0.01, 0, 0.02, 0.007071, 0.007071, 0.02, 0, 0.01, 0.02, -0.007071, 0.007071, 0.02, -0.01, 0, 0.02, -0.007071, -0.007071, 0.02, 0, -0.01, 0.02, 0.007071, -0.007071, 0.02, 0.007071, -0.007071, -0.02, 0, -0.01, -0.02, -0.007071, -0.007071, -0.02, -0.01, 0, -0.02, -0.007071, 0.007071, -0.02, 0, 0.01, -0.02, 0.007071, 0.007071, -0.02, 0.01, 0, -0.02, 0.01, 0, -0.02, 0.007071, 0.007071, -0.02, 0.007071, 0.007071, 0.02, 0.01, 0, 0.02, 0.007071, 0.007071, -0.02, 0, 0.01, -0.02, 0, 0.01, 0.02, 0.007071, 0.007071, 0.02, 0, 0.01, -0.02, -0.007071, 0.007071, -0.02, -0.007071, 0.007071, 0.02, 0, 0.01, 0.02, -0.007071, 0.007071, -0.02, -0.01, 0, -0.02, -0.01, 0, 0.02, -0.007071, 0.007071, 0.02, -0.01, 0, -0.02, -0.007071, -0.007071, -0.02, -0.007071, -0.007071, 0.02, -0.01, 0, 0.02, -0.007071, -0.007071, -0.02, 0, -0.01, -0.02, 0, -0.01, 0.02, -0.007071, -0.007071, 0.02, 0, -0.01, -0.02, 0.007071, -0.007071, -0.02, 0.007071, -0.007071, 0.02, 0, -0.01, 0.02, 0.007071, -0.007071, -0.02, 0.01, 0, -0.02, 0.01, 0, 0.02, 0.007071, -0.007071, 0.02],
          "normals": [0, 0, 1, 0, 0, 1, 0, 0, 1, 0, 0, 1, 0, 0, 1, 0, 0, 1, 0, 0, 1, 0, 0, 1, 0, 0, -1, 0, 0, -1, 0, 0, -1, 0, 0, -1, 0, 0, -1, 0, 0, -1, 0, 0, -1, 0, 0, -1, 0.92388, 0.382683, 0, 0.92388, 0.382683, 0, 0.92388, 0.382683, 0, 0.92388, 0.382683, 0, 0.382683, 0.92388, 0, 0.382683, 0.92388, 0, 0.382683, 0.92388, 0, 0.382683, 0.92388, 0, -0.382683, 0.92388, 0, -0.382683, 0.92388, 0, -0.382683, 0.92388, 0, -0.382683, 0.92388, 0, -0.92388, 0.382683, 0, -0.92388, 0.382683, 0, -0.92388, 0.382683, 0, -0.92388, 0.382683, 0, -0.92388, -0.382683, 0, -0.92388, -0.382683, 0, -0.92388, -0.382683, 0, -0.92388, -0.382683, 0, -0.382683, -0.92388, 0, -0.382683, -0.92388, 0, -0.382683, -0.92388, 0, -0.382683, -0.92388, 0, 0.382683, -0.92388, 0, 0.382683, -0.92388, 0, 0.382683, -0.92388, 0, 0.382683, -0.92388, 0, 0.92388, -0.382683, 0, 0.92388, -0.382683, 0, 0.92388, -0.382683, 0, 0.92388, -0.382683, 0],
          "indices": [0, 1, 2, 0, 2, 3, 0, 3, 4, 0, 4, 5, 0, 5, 6, 0, 6, 7, 8, 9, 10, 8, 10, 11, 8, 11, 12, 8, 12, 13, 8, 13, 14, 8, 14, 15, 16, 17, 18, 16, 18, 19, 20, 21, 22, 20, 22, 23, 24, 25, 26, 24, 26, 27, 28, 29, 30, 28, 30, 31, 32, 33, 34, 32, 34, 35, 36, 37, 38, 36, 38, 39, 40, 41, 42, 40, 42, 43, 44, 45, 46, 44, 46, 47]
        }
      },
      {
        "id": "c498249e5a674e29bc24b0e23246406a",
        "name": "Camera",
        "type": "CAMERA",
        "parent": null,
        "generation": 3,
        "visible": true,
        "transform": { "location": [0.3, -0.3, 0.2], "rotation": [0.775377, 0.502339, 0.208076, 0.321172], "scale": [1, 1, 1] },
        "color": null,
        "mesh": null
      }
    ],
    "sketches": [
      {
        "id": "420d772974c747ebb91283b7ff8d22a3",
        "name": "Sketch",
        "generation": 38,
        "plane": { "location": [0, 0, 0], "rotation": [1, 0, 0, 0] },
        "solver": { "status": "fully_constrained", "dof": 0 },
        "entities": [
          { "id": "p1", "kind": "point", "at": [0, 0] },
          { "id": "p2", "kind": "point", "at": [0.1, 0] },
          { "id": "p3", "kind": "point", "at": [0.1, 0.06] },
          { "id": "p4", "kind": "point", "at": [0, 0.06] },
          { "id": "l1", "kind": "line", "points": ["p1", "p2"] },
          { "id": "l2", "kind": "line", "points": ["p2", "p3"] },
          { "id": "l3", "kind": "line", "points": ["p3", "p4"] },
          { "id": "l4", "kind": "line", "points": ["p4", "p1"] }
        ],
        "constraints": [
          { "id": "k1", "kind": "fixed", "entities": ["p1"] },
          { "id": "k2", "kind": "horizontal", "entities": ["l1"] },
          { "id": "k3", "kind": "horizontal", "entities": ["l3"] },
          { "id": "k4", "kind": "vertical", "entities": ["l2"] },
          { "id": "k5", "kind": "vertical", "entities": ["l4"] },
          { "id": "k6", "kind": "distance", "entities": ["l1"], "value": 0.1 },
          { "id": "k7", "kind": "distance", "entities": ["l2"], "value": 0.06 }
        ]
      }
    ]
  }
}
