{
  "v": 1,
  "type": "lease.acquire",
  "id": "6b0e3f9a2d7c4185a9f4e1c03b8d5a72",
  "payload": {
    "session_id": "2f05d1eb3f1e4ce98dd998abf20cdd33",
    "host_epoch": "de36341c159e4d63a802adfefdfd4683",
    "document_id": "15e12b8b8c12437098bb8a090659c8cb",
    "open_epoch": "5ac7931d230d4870a872dc9e363ca56d",
    "actor_id": "be10cd89a4e841e7b708ae9cdbefeb77",
    "mode": "exclusive",
    "targets": []
  }
}
