{
  "v": 1,
  "type": "voice.grammar",
  "id": "f3b7d4e5a6c74d8e9f0a1b2c3d4e5f60",
  "re": "aa11bb22cc33dd44ee55ff6677889900",
  "payload": {
    "version": "0749158f6332",
    "phrases": [
      "a",
      "about",
      "add",
      "add a boolean",
      "add a camera",
      "add a cone",
      "add a cube",
      "add a cylinder",
      "add a donut",
      "add a light",
      "add a mirror",
      "add a mirror modifier",
      "add a modifier",
      "add a monkey",
      "add a plane",
      "add a sphere",
      "add a subdivision surface",
      "add a torus",
      "add an array",
      "add an empty",
      "add an ico sphere",
      "add mirror modifier",
      "add suzanne",
      "add text",
      "after",
      "all",
      "along",
      "along x",
      "along y",
      "along z",
      "alright",
      "also",
      "an",
      "and",
      "any",
      "apply",
      "apply all modifiers",
      "apply all transforms",
      "apply location",
      "apply modifiers",
      "apply rotation",
      "apply rotation and scale",
      "apply scale",
      "apply transforms",
      "area light",
      "around",
      "array",
      "array modifier",
      "as",
      "at",
      "auto smooth",
      "axis",
      "back",
      "ball",
      "be",
      "because",
      "bevel",
      "bevel modifier",
      "bevel the edges",
      "boolean",
      "boolean difference",
      "boolean modifier",
      "box",
      "break apart",
      "but",
      "by",
      "camera",
      "can",
      "cancel",
      "center the origin",
      "center the pivot",
      "centimeter",
      "centimeters",
      "chamfer",
      "clean up",
      "come",
      "cone",
      "convert it a mesh",
      "convert mesh",
      "convert triangles",
      "cool",
      "copies",
      "could",
      "create",
      "cube",
      "cylinder",
      "day",
      "decimate",
      "decimate modifier",
      "degree",
      "degrees",
      "delete",
      "do",
      "donut",
      "down",
      "eight",
      "eighteen",
      "eighty",
      "eleven",
      "empty",
      "even",
      "extrude",
      "extrude it",
      "extrude the faces",
      "faceted",
      "fewer polygons",
      "fewer triangles",
      "fifteen",
      "fifty",
      "first",
      "five",
      "five copies",
      "five segments",
      "five times",
      "fix the normals",
      "flat shaded",
      "flat shading",
      "flip",
      "flip normals",
      "floor",
      "for",
      "forty",
      "four",
      "four copies",
      "four segments",
      "four times",
      "fourteen",
      "freeze transforms",
      "from",
      "geometry origin",
      "get",
      "give",
      "go",
      "good",
      "great",
      "ground plane",
      "half",
      "have",
      "he",
      "hello",
      "her",
      "hey",
      "hi",
      "him",
      "his",
      "hollow",
      "how",
      "hundred",
      "i",
      "ico sphere",
      "if",
      "in",
      "inset",
      "inset faces",
      "inset the face",
      "into",
      "invert normals",
      "it",
      "its",
      "just",
      "know",
      "lamp",
      "level five",
      "level four",
      "level one",
      "level three",
      "level two",
      "light",
      "like",
      "look",
      "loose parts",
      "low poly",
      "make",
      "make copies",
      "make it a wire frame",
      "make it array",
      "make it bevel",
      "make it boolean",
      "make it chamfer",
      "make it copies",
      "make it decimate",
      "make it hollow",
      "make it mirror",
      "make it repeat",
      "make it screw",
      "make it shell",
      "make it simplify",
      "make it smooth",
      "make it smoother",
      "make it solidify",
      "make it subdivide",
      "make it subdivision",
      "make it symmetric",
      "make it symmetry",
      "make it thick",
      "make it thicken",
      "make it thicker",
      "make it thickness",
      "make it triangles",
      "make it triangulate",
      "make it weld",
      "me",
      "merge by distance",
      "merge close vertices",
      "merge vertices",
      "meter",
      "meters",
      "millimeter",
      "millimeters",
      "minus",
      "mirror",
      "mirror it",
      "mirror it on x",
      "mirror modifier",
      "mirror on x",
      "mirror on y",
      "mirror on z",
      "monkey",
      "monkey head",
      "most",
      "move",
      "move the origin the center",
      "my",
      "negative",
      "never mind",
      "new",
      "nice",
      "nine",
      "nineteen",
      "ninety",
      "no",
      "not",
      "now",
      "number one",
      "number three",
      "number two",
      "object",
      "of",
      "oh",
      "okay",
      "on",
      "on x",
      "on y",
      "on z",
      "one",
      "one copies",
      "one segments",
      "one times",
      "only",
      "option one",
      "option three",
      "option two",
      "or",
      "origin center",
      "origin cursor",
      "origin geometry",
      "other",
      "our",
      "out",
      "over",
      "people",
      "percent",
      "plane",
      "please",
      "point",
      "point light",
      "poly count",
      "pull out",
      "re mesh",
      "re mesh modifier",
      "recalculate",
      "recalculate normals",
      "redo",
      "redo that",
      "reduce polygon count",
      "remove",
      "remove doubles",
      "remove duplicate vertices",
      "repeat",
      "reverse normals",
      "right",
      "ring",
      "rotate",
      "round off the corners",
      "round the edges",
      "rounded corners",
      "rounded edges",
      "row of copies",
      "say",
      "scale",
      "screw",
      "screw modifier",
      "see",
      "select",
      "selected",
      "separate",
      "separate by loose parts",
      "set origin",
      "seven",
      "seventeen",
      "seventy",
      "shade auto smooth",
      "shade flat",
      "shade it smooth",
      "shade smooth",
      "she",
      "shell",
      "simplify",
      "simplify the mesh",
      "six",
      "sixteen",
      "sixty",
      "smooth",
      "smooth it",
      "smooth it out",
      "smooth shaded",
      "smooth shading",
      "smooth the object",
      "smooth the vertices",
      "smooth vertices",
      "smoother",
      "so",
      "solidify",
      "solidify modifier",
      "some",
      "sorry",
      "sphere",
      "split apart",
      "split into loose parts",
      "spot light",
      "sub surf",
      "subdivide",
      "subdivide it",
      "subdivide it once",
      "subdivide it twice",
      "subdivide it two times",
      "subdivide level one",
      "subdivide level two",
      "subdivide once",
      "subdivide twice",
      "subdivide two times",
      "subdivision",
      "subdivision surface",
      "subdivision surface modifier",
      "sun",
      "suzanne",
      "symmetric",
      "symmetry",
      "take",
      "ten",
      "text",
      "than",
      "thank",
      "thanks",
      "that",
      "the",
      "the first one",
      "the second one",
      "the third one",
      "their",
      "them",
      "then",
      "there",
      "these",
      "they",
      "thick",
      "thicken",
      "thicker",
      "thickness",
      "think",
      "thirteen",
      "thirty",
      "this",
      "three",
      "three copies",
      "three segments",
      "three times",
      "time",
      "times",
      "torus",
      "triangles",
      "triangulate",
      "triangulate faces",
      "triangulate modifier",
      "tube",
      "turn",
      "twelve",
      "twenty",
      "two",
      "two copies",
      "two segments",
      "two times",
      "uh",
      "um",
      "undo",
      "undo that",
      "up",
      "us",
      "use",
      "uv sphere",
      "voxel re mesh",
      "wait",
      "want",
      "way",
      "we",
      "weld",
      "weld modifier",
      "weld vertices",
      "well",
      "what",
      "when",
      "which",
      "who",
      "will",
      "wire frame",
      "wire frame modifier",
      "with",
      "work",
      "would",
      "wow",
      "x",
      "y",
      "yeah",
      "year",
      "yes",
      "you",
      "your",
      "z"
    ]
  }
}
